mysql> select * from phone_address_book;
+-----------+----------+---------+-------------+----------------------+
| FirstName | LastName | Address | PhoneNumber | Relative_PhoneNumber |
+-----------+----------+---------+-------------+----------------------+
| Ramesh    | Wagh     | Nagpur  |    78454656 |              5646562 |
| Raghav    | Jain     | Patna   |     8885526 |             56699562 |
| Janvi     | Katre    | Delhi   |     8885526 |             56699562 |
+-----------+----------+---------+-------------+----------------------+
3 rows in set (0.00 sec)

mysql> update phone_address_book set Address='Banglore' where FirstName='Raghav';
Query OK, 1 row affected (0.04 sec)
Rows matched: 1  Changed: 1  Warnings: 0

mysql> select * from phone_address_book;
+-----------+----------+----------+-------------+----------------------+
| FirstName | LastName | Address  | PhoneNumber | Relative_PhoneNumber |
+-----------+----------+----------+-------------+----------------------+
| Ramesh    | Wagh     | Nagpur   |    78454656 |              5646562 |
| Raghav    | Jain     | Banglore |     8885526 |             56699562 |
| Janvi     | Katre    | Delhi    |     8885526 |             56699562 |
+-----------+----------+----------+-------------+----------------------+
3 rows in set (0.00 sec)